{
  "companyName": "DEG",
  "balanceSheetDate": "2022-12-31",
  "totalAssets": 7701888860.0,
  "totalEquityAndLiabilities": 7701888860.0,
  "netResult": 10249807.0,
  "balanceSheet": [
    {
      "lineItem": "1. Entgeltlich erworbene gewerbliche Schutzrechte und ähnliche Rechte und Werte sowie Lizenzen an solchen Rechten und Werten",
      "amount": 2807912.0
    },
    {
      "lineItem": "2. Geleistete Anzahlungen",
      "amount": 387577.0
    },
    {
      "lineItem": "1. Grundstücke und Bauten",
      "amount": 70848833.0
    },
    {
      "lineItem": "2. Betriebs- und Geschäftsausstattung",
      "amount": 5088545.0
    },
    {
      "lineItem": "3. Geleistete Anzahlungen",
      "amount": 1403051.0
    },
    {
      "lineItem": "a) Beteiligungen",
      "amount": 2088313438.0
    },
    {
      "lineItem": "b) Ausleihungen an Unternehmen, mit denen ein Beteiligungsverhältnis besteht",
      "amount": 42703519.0
    },
    {
      "lineItem": "c) Sonstige Ausleihungen",
      "amount": 4580821627.0
    },
    {
      "lineItem": "a) Wertpapiere des Anlagevermögens",
      "amount": 220351532.0
    },
    {
      "lineItem": "b) Sonstige Ausleihungen",
      "amount": 5497368.0
    },
    {
      "lineItem": "1. Forderungen aus dem Investitionsgeschäft",
      "amount": 69925680.0
    },
    {
      "lineItem": "2. Forderungen aus der Abwicklung von Investitionen",
      "amount": 3782662.0
    },
    {
      "lineItem": "3. Forderungen aus Beratung und sonstigen Dienstleistungen",
      "amount": 2320113.0
    },
    {
      "lineItem": "4. Sonstige Vermögensgegenstände",
      "amount": 55034411.0
    },
    {
      "lineItem": "Il. Sonstige Wertpapiere",
      "amount": 2516308.0
    },
    {
      "lineItem": "III. Kassenbestand, Guthaben bei Kreditinstituten",
      "amount": 171301263.0
    },
    {
      "lineItem": "C. Rechnungsabgrenzungsposten",
      "amount": 3270377.0
    },
    {
      "lineItem": "D. Treuhandvermögen",
      "amount": 375514644.0
    },
    {
      "lineItem": "1. Gezeichnetes Kapital",
      "amount": 750000000.0
    },
    {
      "lineItem": "Stand 1. Januar",
      "amount": 1541036881.0
    },
    {
      "lineItem": "Einstellung aus dem Jahresüberschuss (i. Vj. Entnahme des Jahresfehlbetrages des Vorjahres)",
      "amount": 215585315.0
    },
    {
      "lineItem": "Stand 31. Dezember",
      "amount": 1756622196.0
    },
    {
      "lineItem": "III. Jahresüberschuss",
      "amount": 10249807.0
    },
    {
      "lineItem": "1. Rückstellungen für Pensionen und ähnliche Verpflichtungen",
      "amount": 166920194.0
    },
    {
      "lineItem": "2. Steuerrückstellungen",
      "amount": 9221336.0
    },
    {
      "lineItem": "3. Sonstige Rückstellungen",
      "amount": 69291277.0
    },
    {
      "lineItem": "1. Verbindlichkeiten zur Finanzierung des Investitionsgeschäftes",
      "amount": 4482620874.0
    },
    {
      "lineItem": "2. Verbindlichkeiten aus Lieferungen und Leistungen",
      "amount": 484526.0
    },
    {
      "lineItem": "3. Sonstige Verbindlichkeiten",
      "amount": 80964006.0
    },
    {
      "lineItem": "D. Verbindlichkeiten gegenüber Treugebern",
      "amount": 375514644.0
    }
  ],
  "incomeStatement": [
    {
      "lineItem": "a) aus Beratungsaufträgen",
      "amount": 2442901.0
    },
    {
      "lineItem": "b) aus Treuhandgeschäft",
      "amount": 432554.0
    },
    {
      "lineItem": "c) aus Dienstleistungen",
      "amount": 13079359.0
    },
    {
      "lineItem": "2. Erträge aus Beteiligungen",
      "amount": 73951663.0
    },
    {
      "lineItem": "3. Erträge aus Ausleihungen des Finanzanlagevermögens",
      "amount": 260142174.0
    },
    {
      "lineItem": "4. Sonstige Zinsen und ähnliche Erträge",
      "amount": 2031676.0
    },
    {
      "lineItem": "a) Zuschreibungen zu Finanzanlagen",
      "amount": 85397804.0
    },
    {
      "lineItem": "b) Zuschreibungen zu Forderungen aus dem Investitionsgeschäft und der Abwicklung von Investitionen",
      "amount": 327238.0
    },
    {
      "lineItem": "c) Auflösung von Rückstellungen im Kredit- und Beteiligungsgeschäft",
      "amount": 5946036.0
    },
    {
      "lineItem": "d) Zuschreibungen zu Wertpapieren",
      "amount": 423404.0
    },
    {
      "lineItem": "6. Sonstige betriebliche Erträge",
      "amount": 225186269.0
    },
    {
      "lineItem": "7. Aufwendungen für bezogene Leistungen",
      "amount": 1822383.0
    },
    {
      "lineItem": "a) Abschreibungen und Wertberichtigungen auf Finanzanlagen",
      "amount": 287123690.0
    },
    {
      "lineItem": "b) Abschreibungen und Wertberichtigungen auf Forderungen aus dem Investitionsgeschäft und der Abwicklung von Investitionen",
      "amount": 6.0
    },
    {
      "lineItem": "c) Zuführungen zu Rückstellungen im Kredit- und Beteiligungsgeschäft",
      "amount": 4102323.0
    },
    {
      "lineItem": "d) Abschreibungen und Wertberichtigungen auf Wertpapiere",
      "amount": 1388639.0
    },
    {
      "lineItem": "9. Zinsen und ähnliche Aufwendungen",
      "amount": 74832434.0
    },
    {
      "lineItem": "a) Löhne und Gehälter",
      "amount": 65277746.0
    },
    {
      "lineItem": "b) Soziale Abgaben und Aufwendungen für Altersversorgung und Unterstützung",
      "amount": 18575005.0
    },
    {
      "lineItem": "11. Abschreibungen auf immaterielle Vermögensgegenstände des Anlagevermögens und Sachanlagen",
      "amount": 5210976.0
    },
    {
      "lineItem": "12. Sonstige betriebliche Aufwendungen",
      "amount": 188562305.0
    },
    {
      "lineItem": "13. Steuern vom Einkommen und vom Ertrag",
      "amount": 11802977.0
    },
    {
      "lineItem": "14. Ergebnis nach Steuern",
      "amount": 10662594.0
    },
    {
      "lineItem": "15. Sonstige Steuern",
      "amount": 412787.0
    },
    {
      "lineItem": "16. Jahresüberschuss",
      "amount": 10249807.0
    }
  ]
}